,id,name,url,title,review,sentiment
15,1-tt1910621,Space Thunder Kids,https://www.imdb.com/title/tt1910621/,Please read this 1 as a 10,"If you're reading this you too we're drawn here, to imbd, to ask of the universe what we all want to know, those of us who have seen this movie: ""Was that even real?""  ""What did I just watch?""  ""What happened that this movie exists?""  ""Was God watching when man, in his arrogance, foisted this magnificent catastrophe into reality?""  ""Just what ?""  If you're here reading this review, and by some inconceivable trick of fate you have not seen this movie, do yourself a favor: watch it.  Revel in it.  Savor the bad, because baby that's all she has.  It's worth every excruciating minute.  I have to respectfully disagree with the reviewer who left 5 stars. This film is that bad. It's, possibly, the benchmark for bad itself.  Did Minos pause, before condemning his deformed son to prowl the labyrinth, forever shamed; forever reviled? Did he pause to ask himself, what horror have I unleashed? How great will be my name for this thing I have done? If he did, so must have the creators of Space Thunder Kids.  Don't watch this alone.  It might be my very favorite movie.  1/10.",negative
16,13-tt0103923,Captain America,https://www.imdb.com/title/tt0103923/,No. it's so bad it's good. enjoy it to laugh at it.,"I'm confirming it is lame. It suffers from the same issues as the 1994 Fantastic Four, but unlike FF I can give it a, it's so bad it's good stamp (And I'm very happy about that).  Captain America is a pretty easy comic to adapt to the big screen, it's just an action adventure war movie about a guy who sometimes wears a mask. They did take some liberties with the character that make my Fanboy radar point up, but it's superficial.  Steve Rodgers is now a boy from Southern California who has polio and offered himself up to the super soldier experiment headed up by a woman who escaped from the Nazis (The idea of a woman creating the star spangled avenger was cool, not enough female brainiacs in the comic book industry ).  Shortly after Steve Rodgers becomes Captain America the doctor is killed making Steve and The Red Skull the only one's like them. After stopping the Red Skull from destroying the White House he is trapped in Ice for 60 years and wakes up having to stop the Red Skull, who has formed an underground crime unit that basically is Hydra without saying it,again.   Proving how well Cap works as an action movie, Matt Salinger who plays Steve Rogers, wearing some sort of padding to make it look like he's got more than he does, barely wears the cartoonish suit they made for him (of course wearing the uniform makes him Captain America, duh)  It's got that 80s swagger to it. The Red Skull has his daughter do all the heavy lifting for most of the movie with her small army of rich Nazi brats who drive the fastest cars and wear the hottest fashions but more than capable with the guns.  They took some liberties with The Red Skull's origin too, I think this was to save money and film the entire movie in Italy (I'm also guessing that certain places in Italy look more like Southern California than New York City)  I am being harsh on the movie because I've grown to like the character more now than I ever did when I was a kid and saw this, but like I expressed before, the movie does have a so bad it's food quality that makes it real enjoyable.   http://cinemagardens.com",positive
17,5-tt0103923,Captain America,https://www.imdb.com/title/tt0103923/,A Disappointment,"Superhero movies are again a hot property thanks to the big screen adaptations of Spider-Man, X-Men and Superman. As such, many film buffs who know little or nothing about Captain America have no doubt been picking this one up at the video store. Too bad nothing but pure crapulescence awaits them.  Where to begin? The movie has a dim look to it; the acting is second-rate; and the action and battle scenes are few and far between. It will disappoint most die-hard comic book fans, perhaps as much as those silly 1970s Cap films were. On a positive note, the action scenes aren't awful when the viewer finally gets to them. As well, the characters stay pretty true to their illustrated roots, and kids aren't going to be nearly as fussy as adult moviegoers about this one.",negative
18,0-tt0109770,The Fantastic Four,https://www.imdb.com/title/tt0109770/,Oh come on guys this is a great little film.,"The only way to describe this Roger Corman produced flick, is to compare it to an episode of Power Rangers or VR Troopers, on a $1million budget. It is fast paced and fun, over the top and cheesy, and its short comings are there for everyone to see.  In all honesty the cast make the most of what they are given. Alex Hyde White has just the right dryness for the part of Reed Richards, and Rebbeca Staab is quite fitting as Sue Storm. The other characters are less well represented with Dr Doom being the worst offender, over acting as he does through the heavily cheap body armour. The realisation of The Thing and The Human Torch is quite good. The Things full body costume is similar to those used in the Turtles movies, and the Torch is brought to life via some slick animation. Oley Sassone actually gets the best out of the action scenes and coaxes a good atmosphere.  This is a movie worth seeing. It manages to capture a little of the heart of Marvel comics in ways that Captain America(1991) and The Punisher(1989) weren't able to. It is a petty that more money couldn't have been made available because as a representation of the F4 it isn't bad at all. Don't get me wrong, its no Superman The Movie, and this years Fantastic Four movie will rock. But the film is no Plan 9 or Gigli either, and is worth seeing at least once.",positive
19,16-tt0109770,The Fantastic Four,https://www.imdb.com/title/tt0109770/,The Fantastic Four: Clobbering......time?,"I went in expecting cheese, I went in expecting something similiar to the 1990 Captain America or even the 1970's Spiderman but what I got was something altogether different.  This origin story Fantastic Four movie cost 1 million dollars to make which back in 1994 made it a high budget film. The fact it isn't well known and considered mainstream is because it's so bad it's been brushed under the carpet.  With embarassing special effects, a cast who simply can't be bothered and some ridiculous over the top performances & soundtrack the whole thing is truly abyssmal.  I don't know what it is with the Fantastic Four but cinematically they just can't get a break. Maybe when they finally get added to the Marvel Universe they'll have their day but for now I think the 2005 movie is the best one going.  The Fantastic Four is like Batman Forever (1995) made by kindergarteners starring McDonalds workers.  The Good:  Erm...well....there is that part that....errr.....I got nothing  The Bad:  Stupidly over the top in places  Some major differences from the comic  All looks so very dreadful  Is simply seven shades of terrible  Things I Learnt From This Movie:  A blind person can fall in love with a man she's never seen nor even really spoken to  The Fantastic Four are doomed to never have a great movie",negative
20,15-tt0182060,The Man Who Saves the World,https://www.imdb.com/title/tt0182060/,Utterly baffling,"Verily, if someone would ask me the question ""What is the thing that you hate THE MOST?"", this movie should be the answer. This movie is why Turkish movie sector is way back from other countries'. All along the movie, you will not see a sign of the director, creating something -anything!- that is actually the idea of anyone Turkish. I am ashamed that such a movie was shot (copy-pasted, actually). Others might look into this movie as a joke, but I think it is as serious as the assassination of Kennedy (I guess that hits the spot!)! This is the embodiment of all those wasted years of Turkish movie sector! I mean come on! Turkish Star Wars?! It IS the Star Wars!!! I pity the time I wasted watching this movie. I'll kill myself if I hear its name just one more time. It's an affront to every movie I love.",negative
21,17-tt0182060,The Man Who Saves the World,https://www.imdb.com/title/tt0182060/,uh-oh.,This film is the most absurd film of the century. Because of this it must be in the literatures. You can really laugh very much. But the strange thing this film is not made for this purpose. Cuneyt Arkin is the hero and he's very famous in Turkey. He has many historical films like this.,negative
22,0-tt0073168,The Super Inframan,https://www.imdb.com/title/tt0073168/,"A mix of Tokusatsu and 1970s kung-fu, it delivers what he promises.","Shaw Brothers is mostly known for their kung fu films, but they did occasionally try things outside of their wheelhouse namely Mighty Peking Man and Super Infra Man. Super Inframan is your basic rubber suit monster battle but filtered through the lense of Hong Kong kung fu flicks complete with bad audio syncing and out of place sounding impact shots. In terms of plot.....Image if you had an entire seasons worth of Power Rangers plots squished into 90 minutes and compressed the storytelling into about 20 minutes filling the rest with action scenes. The movie is non stop action and unapologetically silly and if you're a fan of silly monster movies or kung fu flicks you'll find something to like. Just don't expect much of a coherent narrative.",negative
23,10-tt0073168,The Super Inframan,https://www.imdb.com/title/tt0073168/,Saturday morning children's cartoon material,"You really need to know what you're in for before watching this film, a 70s Children Morning Show, A Chinese Ultraman, Explosions the Movie. It's very campy, very cheesy, the costumes are pretty bad and laughed a lot throughout the film, there were so many crazy things with it that really didn't make any sense and yet the film just moved on with it. For some reason the big bad knew the guy's name that they kidnapped, they knew about the Professor, as if they had met before, and everyone played it with straight faces.  I was never bored watching this film, it was like they squeezed a full season of villains to this superhero, into one film, so much fighting, so many explosions, such sharp cone-bras. It's not for everyone, but if you wanna see an alternative of what a superhero film from the 70s could look like, you really need to give this one a try, haha.",negative
24,15-tt0077834,Laserblast,https://www.imdb.com/title/tt0077834/,"Eat me, Leonard Maltin...","Some awesome stop-motion animation in a bad film. The only good live action in this movie in every scene Eddie Dezen is in. He plays a real dork in this movie, so he is funny. The aliens in the movie, on the other hand, are fabulous. They were designed by David Allen ( *batteries not included ) and Jon Berg ( star wars ). They were animated by Randall Wiliam Cook The Gate ) and David Allen. With all of this talent on board, these aliens are truly majestic and awesome. Stop-motion animation fans need to check this one out for the aliens. I love them! The movie, however, is a drag. 4 out of 10.",positive
25,2-tt0077834,Laserblast,https://www.imdb.com/title/tt0077834/,"A bad movie, but not that bad","I was expecting Laserblast to be awful, judging by its position in the ""Mystery Science Theater 3000: 10 Worst Movies They Riffed"" list and its reputation. It is a bad movie- though I can see why people would find it entertaining to watch- but it is much better than the likes of Monster A-Go Go, Manos the Hands of Fate, The Wild World of Batwoman, Merlin's Shop of Mystical Wonders and Hobgoblins, and in general there are far worse as well. The best asset of Laserblast is the music score, which pulsates through the movie with great energy and atmosphere that is not matched with the rest of the movie. Cheryl Smith is sweet and sympathetic and Keenan Wynn is appropriately gruff. And I personally though the stop-motion and the aliens were quite good, of any of the movies on the ""10 Movies they Riffed"" list it is Laserblast that has the best special effects. Everything else comes up painfully short though, Roddy MacDowell is wasted to the point that you question why was he even in it, and Eddie Deezen has to be the most annoying bully ever seen in film. The story is a real drag as well, it makes very little sense if at all, has so much overlong filler that adds nothing to the storytelling and is one of those instances where the plot summary pretty much sums up the whole movie. It also doesn't know what to do with itself and takes forever to get going, it is half-an-hour until anything of the sort happens and then when the gun is found the rest of the movie is just stuff getting shot at. At best, the camera work and editing are haphazard, the dialogue is hysterically bad and the characters are not developed anywhere near enough or characterised very effectively to be believable or likewise. In conclusion, Laserblast is a bad movie that is rather dull and senseless and wastes McDowell but a great score, better-than-average stop-motion and effects and two decent performances make it not as bad as all that. 3/10 Bethany Cox",negative
26,14-tt0105643,Troll 2,https://www.imdb.com/title/tt0105643/,"If this movie passes for a horror flick, then so does Bambi","Troll 2 is a movie so bad it got famous for being it and i will always love it.  Troll 2 is not the sequel to Troll from 1986 the original name for the movie was goblin.  It isn't any trolls in the whole movie only goblins, that makes the movie even better because how stupid it is. Grandpa Seth is one favourite character ever in movie history, he's like a superhero, his superpower is that he can't die he just comes as a ghost.  So if you want to see the best movie of all time, watch this.  But overall it was a masterpiece💫",positive
27,3-tt0105643,Troll 2,https://www.imdb.com/title/tt0105643/,The Holy Grail of bad movies,"You often hear of movies that are so bad that they're good. It's hard to point to a single movie that is like this though. What some may say is ""so good it's bad"" may come off to others as just plain bad. However, everyone I have talked to who has seen this movie has agreed: Troll 2 is so horribly, shamelessly bad, that it is good.  The writing for film is more than awkward (take the redundant ""Stonehenge Magic Stone""), and the character dialogue sounds so incredibly unnatural they might as well be robots. The reason for this is because the man who wrote the script and directed it, Claudio Fragasso, is a native speaker of Italian. He wrote the script in English when English was (barely) his second language. The acting is absolutely terrible, but who can blame them? This was most likely the first (and last) film any of these actors have been in.  The costumes and special effects have that wonderful B-movie quality to them. While there are many blaringly obvious errors, I find that the smaller ones are actually funnier. Actors shaking when time is supposed to be ""frozen,"" or flies on their face during the climatic scenes. There are so many continuity mistakes that I sometimes found myself wondering if the director was putting them in on purpose. It was like every time the camera shot changed, the crew completely forgot how the previous shot was set up, and had the actors give their best guess on where they're supposed to be.  I think everyone needs to see at least a few horrible movies in their lifetime. Troll 2 is entertaining and hilarious, especially when watched with friends. The plot is ludicrous, but at least you never know what's going to happen next. Many scenes seem completely unnecessary, and this film simply does not bother to justify any of the things that happen in it. The end result is a horror B-movie that ends up being so horrible that you can't help but laugh. The only question I find myself asking now is do I give it a ""1"" because it was so bad, or a ""10"" because it was so good?",positive
28,17-tt0106620,Contamination .7,https://www.imdb.com/title/tt0106620/,Trash,"They say lightening doesn't strike twice but check out Crawlers. This film is produced by the people who brought you that masterpiece known as Troll 2. Honestly this film doesn't match the pure genius of Troll 2 but it sure comes close. First, check out the Alaskan setting. Everyone knows that Alaska is beautiful and scenic but who knew it was so freaking hot! That Alaskan summer will kill you. At least five characters complain about the ungodly Alaskan heat. Second, the boss at the nuclear power plant might be the greatest actor I've ever seen on film. His tone of voice never changes. Its an amazing feat of line reading and I do mean line reading. This man deserved an award for this performance. No one can be that horrible. I believe its a commentary on the robotic nature of our everyday lives. This man deserves our respect. Third, look out for those flying roots. Tremendous special effects work permeates this film. Check out that helicopter crash. Was that a fisher price model? I do believe it was. And how about the tonka truck bulldozer. I guess they only had enough money to rent the real deal for a very brief time. All in all this film isn't quite as good as Troll 2 but it come pretty close. Watch and learn about the true art of filmmaking.",positive
29,16-tt0106620,Contamination .7,https://www.imdb.com/title/tt0106620/,So this is the infamous Troll 3.,"Well, I would not go out of my way for this one...  Its a nice idea, but DAMN its so cheesy!!!  I really do not know what more to say - Its a typical Exploitation Movie in many ways... Seriously Low Budget, Very Poor Acting, all around its fun!  I saw someone review say that it was being offered as a PAY PER VIEW? Dear God NOOOOOOOOOOOOOOOOOOOOOOOOOOOOOOO!  If you see it on The Horror Channel or something, take a chance... Its harmless fun!  Is there anything good I can say about the film? Yes... A Very predictable but good twist ending!  Just like Troll 2, You would not be missing out in this Sequel - If you can even call it that... It has nothing to do with its predecessors ... Not even under its many other names!  But if you want Cheese... Worth a shot!",negative
30,7-tt0100448,Quest for the Mighty Sword,https://www.imdb.com/title/tt0100448/,See it just to find out how bad a movie can be.,"Well, I thought I had seen bad movies before............but this one is the worst by far. No plot, overweight and drag-queen-like ""hero"", cheap plastic monsters and effects, new york accents on all of the characters............. can you really get any worse? Even the background music is ridiculous.......often sounding Japanese, then techno, then just non-descript and drowning out the dialogue. Actually, the music drowning out the awful dialogue is probably the best thing to say about this movie. And just when you think the movie hits bottom, it never fails to disappoint you in reaching yet further into poor cheap effects. I am truly at a loss for words.",negative
31,3-tt0100448,Quest for the Mighty Sword,https://www.imdb.com/title/tt0100448/,Literally the worst movie I've ever seen... I want to watch it again.,"The cream of the crap... This movie was literally the worst I've ever seen. Everything was wrong: plot, acting, music, costumes, special effects, script... the list goes on extensively. Every film-making mistake imaginable was made in this film... yet I loved every minute of it. Its hard to imagine it as being a legitimate effort at making a motion picture, but as far as I know, it wasn't intended to be humorous. A movie so terribly bad that it becomes so wonderfully good. I would recommend it to anyone looking for a good laugh; I'm actually considering purchasing it (that is if I can find it anywhere... I doubt it).",negative
32,6-tt0093507,Masters of the Universe,https://www.imdb.com/title/tt0093507/,"Unfortunately, a disappointment","This bad lad turned up on Prime and brought me way back to Enternia.  Could not believe it's a 5.4!! This movie is pure gold.  The soundtrack is awesome.  Dolph is Dolph like in every movie.  Lubic should have been in the movie more, would have been an 8 if that was the case.  The movie bombed due to the budget. I had this bad lad on VHS and watched it well over a 100 times.  It's there with the goodies, Killer Klowns, Big Trouble
In Little china.  You either love the full on 80s flicks that age great in time or you bring it down. Some great memories here and most important it's a good movie even in May 2024.  Forget the 5 it's a 7
You have the POWER.",positive
33,18-tt0093507,Masters of the Universe,https://www.imdb.com/title/tt0093507/,Better Than MOTU: Revelations,"""I Have the Power!""  For those of us who grew up in the 80's, that phrase is all too familiar. Especially for those who would rush home after school to watch our favorite strongman face off against the forces of evil that threaten the safety and security of his homeworld.  For my money, it was never better than when He-Man faced off against Skeletor for the struggle for Eternia.  I also remember the fantasies that I and my friends would have of traveling away to that world of magic and fantasy, to fight alongside He-Man as he defends Grayskull.  It truly was a series that was out of this world.  And now it's on Earth.  When I first heard about a live action movie, (mind you, I was twelve at the time), I was overly excited about it.  But I didn't get to see it until my late teens.  And I must say that it was very well done, especially in its presentation.  In fact it brought back those far away childhood memories of those late afternoons in front of the tv, or outside with the toys a make-shift Eternia setting with my friends.  I'll grant a few things that were wrong with the movie though.  There were times that I think the script was either badly edited, or just too rushed at certain points.  I'm also not thrilled about them being on earth, but understanding budget constraints and the idea to make these characters more real than fantasy help feed into that decision, so I let that one go.  I would have also liked to see more of the characters from the toys in the movie, but have no complaints that they made up a few cool characters, like Blade.  The casting choices, I felt, were really good.  Dolph Lundgren worked as He-Man, even though he can't act.  He looked the part, and even pulled off the role.  I could tell that he wasn't walking through the part, as many actor will do with character roles (right Mr. Clooney?).  And Frank Langella the PERFECT choice for Skeletor.  Langella managed to bring that character to life in a way that gave me chills.  Skeletor is perhaps one of the greatest villains ever imagined, but the cartoon made him a cackling villain, who was more a buffoon than anything, therefore he didn't seem threatening.  But seeing Langella make Skeletor more dark and evil put my faith back into the conviction as a great villain.  You don't have to be a die hard fan of the series to enjoy the movie.  It's great fun, imaginative, and it captures a moment in time.  Don't scrutinize the movie because it's different from the cartoon.  Look at it for what it is, and don't focus on its faults.  It had the power to recapture my imagination, so its not all that bad.",positive
34,13-tt0052169,The Screaming Skull,https://www.imdb.com/title/tt0052169/,Bone-headed....,"This movie was mildly, mildly entertaining. Mainly because you keep thinking it's bound to get better. It doesn't, but you keep thinking it must. Basically, it's about a woman who gets married to a man who's first wife died tragically. As time passes, she begins to suspect that she is being haunted by the woman. While this film has some creepy moments, most of it is pretty boring, and nothing is really ""scary"". Most of you will also be able to see the ending long before it comes. Still, it's not a ridiculously TERRIBLE movie. And I'm sure I've seen the main character before somewhere, though I'm too lazy to actually look up her actor profile.",negative
35,10-tt0052169,The Screaming Skull,https://www.imdb.com/title/tt0052169/,Portrait of a Lady,"When you have a disembodied skull, an empty mansion, a schizophrenic wife, a scheming cad and a nutzo gardener, throw in a minister and his wife - what have you got?  AIP's answer to insomnia.  ""The Screaming Skull"" gets points for audacity, offering free caskets for anyone who dies of fright from watching the film.  Pretty safe bet, when you're lulled into a stupor by people who think they're in a production of ""Suspense for Dummies"".  But Peggy Webber was a cutie, anyway.  She had a few good moments of acting here and there (especially when trying to communicate with the gardener) and no one else fills a nightgown like she.  But that scared face she makes - scary in itself.  Whoa.  As a whole, though, there is little suspense here and everything is telegraphed like a punch thrown by a mime.  You can't be scared by this film, it's impossible.  It has its moments, but not enough of them.  HOWEVER, thanks to a certain Mike Nelson and his two robot pals, there are several moments of pure joy, especially in the copy THEY got hold of (""The film jumped, and it was really scary!"").  One star for ""The Screaming Skull"", eight and a half for the MST3K version.  Talk about a ""Screaming"" bore....",negative
