,id,name,url,title,review,sentiment
68,6-tt0118577,An Alan Smithee Film: Burn Hollywood Burn,https://www.imdb.com/title/tt0118577/,My Two Cents,"All I can think about this horrid piece of crap is:  ""Oh, Jesus Christ.""  The ""idea"" of this movie is a good idea. The execution of this film was the worst. Some say, ""Well it's an inside Hollywood joke."" No, it isn't. ""Kid Notorious"" on Comedy Central is an inside Hollywood joke. Joe Ester-whosits is an inside Hollywood joke -- that continues to get a paycheck. But...there isn't anything actually WRONG with that..as we can all see, there are many inside Hollywood jokes that are getting paychecks while talent is still knocking at the door.  As I've written, the IDEA of this film was a savvy one -- it just doesn't transfer--or makes sense -- in this film. We all know who ""Alan Smithee"" is and its kinda funny to see a real ""Alan Smithee"" want to take his make off of a film. Funny -- for about 15 seconds. Then we have a whole 'nother hour or so of this movie to go, of nothing but pure hell masquerading as ""a Hollywood inside joke"".  The guy who writes on Bazooka Joe Bubble Gum wrappers would have done this film better. Much Better. 'Oscar' Caliber better. Okay, I went a bit too far on the last better comparison.  Or did I?!?!?",positive
69,15-tt0118577,An Alan Smithee Film: Burn Hollywood Burn,https://www.imdb.com/title/tt0118577/,"Well, it's not Human Highway.","Burn Hollywood Burn is a terrible movie in every sense of the word and its only redeeming quality is because of an accident that occurred after filming concluded.  On concept this high brow yet simple movie of mockery is a thing of genius. I mean make a movie about a guy named Alen Smithee whom is losing control of a big budget movie. However, he cannot disavow the movie because he is the ""fake name"" he is Alen Smithee. Now thats funny (but maybe only if you know movie history?) Perhaps it is to high brow because nobody went to see this film. OR perhaps it is to English (ie Eric Idle as the leading role). Or perhaps it is just plan terrible.  The movie basically, rather than poking fun at Hollywood and the stream of never ending big budget special effect extravaganzas (which Eric Idle's character is making 1 of), pokes fun at itself instead. It jokes about the movie being made is worse than Showgirls (BHB is from the writer of Showgirls), but in reality the movie (BHB) itself is worse than Showgirls.  The actors just don't have any fun and are not very good.  They are stuck in the middle of hamming it up and actually acting.  This is probably because the fake movie is supposed to be bad, but instead that badness overflows into the real movie.  Jackie Chan, Sly Stallone, and Whoppie Goldberg cameo as overpaid and past their prime actors demanding huge wages and silly concessions and while some aspects are true, they don't all apply to the actors (Jackie Chan wanting like red M&ms taken out or something?) Anyway, the movie turned out to be directed by Alan Smithee which is almost a saving grace, but it had to be the writers cut which survived to get that moniker and not the directors cut. (the incident occurring after filming wrapped) Perhaps doing as such was a lame attempt to save a lame movie, but this movie about making a bad movie turned out to be just that= aka A BAD movie",negative
70,10-tt0368226,The Room,https://www.imdb.com/title/tt0368226/,"""I DID NAAAAGHT! Oh hi, Mark.""","This cinematic masterpiece follows the life of an alien attempting to fit in with his human surroundings. the story is told through the aliens perspective, and because his species perceives time and events differently than ours, some of the events may seem confusing to the viewer at first. however, once the viewer understands that johnny is simply not from our world, you can truly understand the turmoil hes in. truly a tribute to modern artistry",positive
71,2-tt0368226,The Room,https://www.imdb.com/title/tt0368226/,Disaster movie,"Okay - quality of the movie [0/10]
Enjoyability of the movie [10/10]  Total paradox, right?  This is the absolute pinnacle of bad story, bad dialogue, bad editing, bad plot.. I mean, I'm saying 'bad' like there actually is any of these elements within the film. The editing makes no sense, it seems randomly cut with continuity errors, there are lines like 'What's going on with the candles and the music' when there ARE NO candles or music.. The entire thing is absurd. But what makes it truly unique is that it was done entirely seriously, this is not a tongue in cheek production like low budget bad movies that know they are catering to an audience who expect to laugh at the poor effects and story.. No, this man, Tommy Wuseau, honestly, genuinely thought he was crafting his magnum opus, masterpiece of cinema.  Is it good? Absolutely, definitely not.  However - as a movie EXPERIENCE. I watched this with some of my family, warning them it was terrible, but we had one of the funniest, most incredible bonding experiences in cinematic history - As we collectively picked apart every camera angle, wobbly set, insane use of props, costume, music that skips, repeats, continuity, edits, plot and dialogue. There is not one redeeming moment in the entire movie. Even if there is a single well crafted line (there isn't) it would have to be spoken by either a terrible actor or by Tommy himself, who's accent sounds like it was in a European car crash . We all laughed until it HURT, and for that.. I have to give the experience a 10/10. I've never enjoyed a movie more with friends and family more than this one.. EVER.  I head that the experience is similar in theatres that still show this film for precisely this reason. Everybody dresses up as their favourite character, recites every line and throws spoons at the screen every time one inexplicably ends up on screen (it's a lot.. is there a reason behind this 'artistic' decision. No. There is no reason for anything)  There is more and more to notice about this film every time I watch it.. Most recently, how the architecture of the building makes no sense whatsoever. They appear to be on the ground floor, but exiting from the other side causes them to end up on the roof - at night. It's things like this that could inspire a PhD in studying the intricate insanity and entirely non sequitur values of every moment in The Room.  Do I recommend it? Well.. how can I not. Everyone needs to see this movie at least once, after a couple of drinks and with friends. It's even funnier than Weekend at Bernies after taking magic mushrooms.  I almost died laughing from a hypoxic brain injury, unable to catch my breath - narrowly avoiding giggling myself into a coma.  The finest abdominal workout video ever made.",positive
72,16-tt0369226,Alone in the Dark,https://www.imdb.com/title/tt0369226/,Huh? And huh? again.,"On my list of ""worst movies ever made"".   There is nothing likable about this movie. It's totally worthless noise.  Honestly, I cannot think of one single redeeming moment... the story is stupid, the script is trite, the characters are 1-dimentional (as is the acting); I could care less if they lived or died. There's nothing special about the effects, nor the cinematography, nor the score. Several pointless scenes of mindless, ear-numbing shoot-em-up's that neither moved the plot along, nor offered any entertainment value, whatsoever.  No one should be subjected to this film, ever, under any circumstances. The only thing this film is really good for is fire kindling.",negative
73,17-tt0369226,Alone in the Dark,https://www.imdb.com/title/tt0369226/,Brilliant casting,"I give this movie a full ten stars due to the hilarity of its directors commentary, not because of any quality in the film (for there is none). When my brother rented House of the Dead, after his appalled viewing he watched it with the directors commentary to see ""what the hell the director was thinking"". And the commentary was better than the movie. So now we rent this guy's stuff just to laugh our asses off with his idiotic musings.  He actually believes that his movies are works of art!! You'll giggle uncontrollably when you watch Alone in the Dark (and any other Uwe Boll movie) with the commentary. He refers to his ending as ""Lynchian"" (for a reason that the viewer--nor, apparently, the director--can explain. He constantly makes fun of Tara Reid and complains that she doesn't take off her bra. He refers to every shamelessly ripped off scene as an ""homage"". Best of all, he complains that he is a misunderstood genius who has been unfairly criticized on this very site, IMDb. Chances are he is reading this review and others at this moment and plotting about how to incorporate his rebuttals into his next commentary track.",positive
74,3-tt0064255,Dracula (The Dirty Old Man),https://www.imdb.com/title/tt0064255/,Best of a bad genre,"I haven't seen this film in awhile, but remember it pretty vividly. The film was obviously shot on a really low budget and without any real actors. It has a kind of ""Manos"" feel to it, but with nudity and even worse special effects. There are bats that are obviously on wires and some pretty cheesy costumes. The guy doing Dracula's voice sounds like an old Jewish man (I don't know where the hell they got the idea to make Dracula Jewish, considering he was Transylvanian). The only thing that I liked about this movie is that it didn't take itself seriously at all.  Count Dracula is living in an abandoned mine in the middle of nowhere. He invites a local reporter to visit him (he goes under the pseudonym of Alucard, hee hee hee, like nobody's ever heard that before). When the inept reporter gets there, Dracula turns him into a pretty crappy looking wolf man, named Irving Jackelmann (enough with the Jewish jokes already). Dracula then sends him out to catch beautiful girls for him to tie up, love up and drain dry. Dracula takes a hankering for the reporter's girl friend and ends up chasing her around his cave.  The opening ten minutes have some really awful stream of consciousness speech by the reporter involving the blue mountains, behind the blue mountains, behind the blue mountains (we get it already). Dracula's accent is just plain annoying. Irving Jackelmann also proves to be pretty bad. The chase scene, for the love of God, was only a nude woman running around the same set for an excruciatingly long time. The nudity can't save it and the jokes, although trying hard to be campy, are just plain dumb.  Avoid unless you can spare a few brain cells.",positive
75,0-tt0064255,Dracula (The Dirty Old Man),https://www.imdb.com/title/tt0064255/,Funny then porny,"The first 20 or so minutes of this film are really hilarious. REALLY funny. The dialogue and overdubbing are so beautiful. This is the best example of bad dubbing I have ever seen. Who knows, maybe they were doing it on purpose. Either way, the words they chose to use as the script are almost like they didn't know the original story and were making it up as it went along. Telling jokes the whole time and making funny comments about everything that you wouldn't normally hear a character in a movie say. They cut on each other and talk about how they have to go to the bathroom and juvenile things like that. I doubt it translated much at all from the original.  After the funny parts at the beginning (like the opening monologue about the blue mountains), the movie goes downhill and becomes monotonous. It's like soft core. But it's sort of rude! Dracula gets these women naked and then insults them because they have small breasts or are too heavy or something. Usually you have a naked woman on the screen and everyone is excited. But Dracula is very snooty and picky! It's sort of funny, but also sort of mean. Especially since I don't think he was supposed to say those things originally.  A funny movie because of the new script. The best parts are at the beginning. The wolf man is very well done. Dracula is kind of sexy. The naked woman are too much for me. Funny then porny.",positive
76,15-tt0199861,Ninja the Protector,https://www.imdb.com/title/tt0199861/,Activates the desire to kill when applied to the human body!,"They say that a film can change your life. For some it was Citizen Kane. Others Schindler's List. For me it was Ninja The Protector.   From the plot that made no sense, to the constant cartwheeling, to the poor dubbing (even over the English-speaking actors), and the steady stream of Channel 5 heyday soft- porn scenes, Ninja The Protector is not only one of the best martial arts-cum-porno films, but one of the greatest films ever made.   Prepare yourself for sex, motorcycles, shirukens, teleportation and the best f*cking moustache since moving pictures were committed to celluloid.  Quality personified.",negative
77,3-tt0199861,Ninja the Protector,https://www.imdb.com/title/tt0199861/,classic great white ninja film,Once again 'harry' must stop the ninja empire. This time by  infiltrating a model agency with the help of one of his agents who  he doesn't share screen time with (one of the downsides to being  in a film cut together from 2 films). Harrison does rather touchingly  keep a photo of his model/ninja friend who i think is called Warren. Harrison has honed his martial arts skills to perfection for this  film and it has paid off in spades. He's great with a blowpipe and  his teleportation skills just get better and better. i only have two complaints with this film.  Firstly: It's quite hard to see Harrison in his Ninja attire due to the  fact it's camoflage material and often Harrison vanishes into the  background. Especially during scenes filmed in a park.  Secondly: I couldn't watch the end because it concentrated on  Warren's relationship with his brother David. David's not a  handsome chap and seeing him do the nasty with a random  wench made my eyes bleed.  Overall though i'd give it 9/10. It's the kind of film that makes you  want to run up a hill in your pyjamas and shout NINJA! loudly.,positive
78,0-tt0190374,Dungeons & Dragons,https://www.imdb.com/title/tt0190374/,Easily forgotten,"This movie is what defines ""nothing special"". You watch it, you like some parts, some you don't, and you will never think about it once you leave the theater.  As a player of the Baldurs Gate computer game, the D&D cosmos is nothing new to me. But in this movie, most of the inherent magic of this fascinating world was simply let out for poor effects and cheap character stereotypes. The female mage has nothing to do but to look nice and to scream in moments of danger. She hardly ever uses her magic abilities, and therefore is a splendid example of the poor role play adaption this movie is. She is no mage - she is simply a damsel in distress.  The humor of the movie also is very simple and nothing to really laugh about. That is, if you leave out Jeremy Irons' incredibly bad acting - his bad mage routine should be added to acting books under the chapter ""how to overplay a character"". But, to be true, those were the most funny moments of the movie, so at least Irons was good for something here...  All in all a rather unspectacular start to the new wave of fantasy films which will accompany the giant blockbuster ""Lord of the Rings"" production. I pray to God that the Tolkien adaption will be far better than this mostly trashy b-movie.",negative
79,2-tt0190374,Dungeons & Dragons,https://www.imdb.com/title/tt0190374/,"If you love D&D, you'll hate this movie","I've been playing or DMing (A)D&D for most of my 38 years. Even before I hit my teens I was writing better scripts for adventures then exist in this movie; there are so many plot holes the truck hasn't been built that's too big to drive through them, and despite having a cast of actors that aren't all that bad, the acting is in most cases similarly dreadful.  So, if you've ever played (A)D&D do yourself a favour and DON'T watch this movie, to avoid all the hair being ripped out of your skull whilst watching. If you've never played (A)D&D then STILL DON'T watch this movie - rent out Willow or Princess Bride or Ladyhawke or Lord of the Rings to get an idea about how good a campaign/adventure could be; watching this will just put you off ever playing the game.",negative
80,12-tt0101412,Beastmaster 2: Through the Portal of Time,https://www.imdb.com/title/tt0101412/,"Not that bad, really...","This one kind of is like an earlier movie from 1987 ""Masters of the Universe"" based on the cartoon ""He-man"". Basically, you have a great old world and they for some reason have to have nearly all the action of the movie take place on modern earth. Well I guess it is not so modern earth now and that it is an ancient world now of strangeness and a den of good times gone by. Well I guess I can figure why they did in fact place nearly all the movie in modern times in this and that movie. To save money on costumes and sets. It is a lot easier to recreate what is going on in the present than a strange world like that of Eternia in He-man or an ancient world with cults and strange pyramids, sacrifices and strange creatures that hug you to death. This movie is forgettable and not very entertaining, your first clue that it is not going to be the best movie in the world is that Robert Z'Dar is in it. The only thing this one has going for it is the animals which are not as prevalent in this one as they were in the last. Marc Singer is back and it is sad to seem him in this state, the guy was a fairly good actor reduced to trying to make a sequel to a movie that really did not need one, and even if it did it came five years to late.",positive
81,10-tt0101412,Beastmaster 2: Through the Portal of Time,https://www.imdb.com/title/tt0101412/,Probably better not to watch it,"I liked this movie way too much.  My only problem is I thought the actor playing the villain was a low rent Michael Ironside.  Of corse Ironside is just a low rent Jack Nicholson.  I guess Mike was busy that year with ""Highlander 2: The Quickening"".  Sadly ""Beastmaster 2"" would have been a much better career move.  It is certainly the best of the Beastmaster series and in many ways reminiscent of that great big screen classic ""Masters of the Universe"".  Not only does it star the incomparable Mark Singer it also features an amazing supporting cast, specifically the second girl from ""Sliders"", Uncle Phil from ""Fresh Prince of Belair"" and evil chick from ""Superman 2"".  It rocked my world and is certainly a must see for anyone with no social or physical outlets.  BEASTMASTER FOREVER!!! ROCK'N ROLL!!!",positive
82,2-tt0097942,Mystics in Bali,https://www.imdb.com/title/tt0097942/,Occasionally amusing and gruesome Indonesian horror.,"An American woman named Cathy asks her Indonesian boyfriend Hendra to help her investigate Balinese black magic known as 'Leyak'.Leyak is the most powerful black magic there is and she soon begins to pay a terrible cost when she turns into a flying head that feasts on unborn babies.I have seen my share of crazy Indonesian horror cinema and ""Mystics in Bali"" is perhaps the most known of 'em all.It is based on Indonesian mythology and for a supernatural culture largely undiscovered by Western movie fans.The special effects are incredibly cheesy and inept,the dubbed dialogue is absolutely hilarious,still there's a flying head which has the body's internal organs trailing behind,along with a little foetus eating and an evil sorcerer for all of you fans of Indonesian trash.The main actress Llona Agathe Bastian is incredibly wooden-in fact she was never an actress at all,but a German tourist spotted in Bali by one of the producers.Give this amusing trash a look.7 out of 10.",positive
83,12-tt0097942,Mystics in Bali,https://www.imdb.com/title/tt0097942/,"Great great great piece of work, my kinda flick.","""Mystics in Bali"" is a wonderfully bizarre, off-the-beaten path Indonesian horror/supernatural flick about an American writer researching black magic. She's experienced the voodoo of the Caribbean, but she runs into some real trouble as a student of the Leak in Bali.  There are a lot of disjointed plot points and the dialogue is weak, but the music (I doubt traditional Balinese music has been used in a horror flick before) and total oddity of a flying head make this a worthwhile view for fans of the unusual.",positive
84,7-tt0050432,The Giant Claw,https://www.imdb.com/title/tt0050432/,A giant bird with teeth!,"The movie is called "" The Giant Claw "" and it was originally written by Samuel Newman. In 1957 I and my boyhood friends were 11 and twelve year olds. At that very young age we attended in a group the weekend Monster theater at which time the above film was featured. Having never seen the movie, we of course were taken completely by surprised by the flying monster, each time it appeared. I and the rest of our group exploded with frightful wails of terror, screams of fright and piercing cries of horror. This noise was echoed and multiplied in volume many times when they joined the cacophony of noises throughout the rest of the theater. Truth was, the management was tickled pink by our childish fears and antics. The movie itself proved nonsensical, poorly made, Juvenal, Shylock, half baked and phony in every respects. Still for 1957 it was the stuff of frighting childhood dreams and we were of that age. As an adult, I am amused at what I considered frightening and snicker at sci-fi scenes from B-Picture actor like Jeff Morrow, Dabbs Greer and what the character's called a nightmare chicken. Yet in retrospect, they were the heroes of my youth and the foundation of what today are considered Classic Monsters of my childhood. Enjoy the novelty, youth doesn't last long.",negative
85,13-tt0050432,The Giant Claw,https://www.imdb.com/title/tt0050432/,ATTACK OF THE GIANT TURKEY!,"I really cannot understand why this movie was made. At least you get to see some standard 'B' actors such as Jeff Morrow, Morris Ankrum and Mara Corday who is a cute as she can be. Well you guessed it, this thing is about a big bird, what you couldn't have guessed is that it crossed the universe, believe it or not, to build a nest and lay eggs on our 'pale blue dot'(from Carl Sagan). This film has got to win the award for the use of the most stock film shots ever. In more than one sequence, you see folks running in panic in the streets of New York. --Shots taken straight from the Beast From 20,000 Fathoms. The special effects were not special, the bird was laughable, and there are so many continuity mistakes. I must have missed the transition from Mara thinking Jeff was a real immature jerk to the heavy romance. (??) Never-the-less I watched the movie wishing it would end yet interested enough to want to know how it would end. It seems to me that considering what a menace this bird was supposed to be, that there would be whole raft of scientists and military types trying to figure out how to kill this thing, there weren't, just a handful. Maybe because of the ridiculously low budget. I am glad however to have a copy to add to my 50's B Monster collection. There is no other film in my collection as bad as this one. I loved it!",positive
86,22-tt0093608,Nekromantik,https://www.imdb.com/title/tt0093608/,more then meets the eye,"Employed as part of a team that cleans corpses off the street, a young necrophile enjoys taking home body parts (and whole corpses where possible) for him and his girlfriend to enjoy in this low budget flick from Germany. Banned upon initial release in several countries, 'Nekromantik' definitely comes with some shock value as it depicts in grisly detail just how the two lovers use their corpses and body parts in their lovemaking routines. What's more, the film even manages to drum up some sympathy for its protagonist who is ostracised by his colleagues and who does everything possible to satisfy his girlfriend's interests (one gets the sense that she was always more into it than him). Unfortunately, the film falls apart around halfway through as his girlfriend walks out, leading to him quite literally meandering around. He cries in the bathtub, goes to watch a horror movie that is not nearly nasty enough for him, and the list goes on as he wallows in depression. And yet, while the fact that the story comes to a virtual halt in the second half is perplexing, it is arguably the less shocking nature of the majority of the second half that underwhelms the most. The extent of the young couple's deviancy is the real highlight here, particularly with all the intriguing questions of what led to them to have such a perverse interest in corpses. The graphic scenes of the protagonist and his work colleagues cleaning corpses up is pretty intense too. Those interested in a shock or two will likely not be disappointed here, but the film is also never quite the cohesive whole that it could have been.",negative
