,id,name,url,title,review,sentiment
36,7-tt0119707,Mortal Kombat: Annihilation,https://www.imdb.com/title/tt0119707/,God no,"I have been a big fan of MK since the beginning, although I must admit I lost interest in the game series after part III.  Buying MK Deception this past Christmas renewed my interest in the series.  This movie was crap and I can't believe I bought this mess.  Good thing I found it for 9.99 at the used bin, so I wasn't out of much.  I was expecting to see a REAL sequel to the first movie, which I found fairly entertaining.  I thought the first film was very good and does the game upon which it is based some justice.  Not the case with MKA.  The first problem is that they tried to fuse too much of MK2 with MK3.  Then, if you're going to replace a character with another actor (Christopher Lambert), then at least make sure the new actor does a batter job than the first. The first Raiden was a hard-ass, and you knew not to mess with him. The second Raiden was a wuss and every time we saw him he was going through a wall.  Weak portrayals of major MK characters was another flaw.  The actress who portrayed Sonya Blade was nowhere near as good as Bridgette Wilson (the first Sonya).  Same could be said with Cage (Linden Ashby).  What was the point of even having Ermac and Rain in the movie if they weren't going to be referred to? A very weak portrayal of Sindel, Kitana's mother and the actress who played her isn't fit to act in soap operas.  Line example: Kitana: ""My mother is dead."" Sindel: ""As will be her daughter!"" Gimmie a break! Stick with the first.",negative
37,4-tt0119707,Mortal Kombat: Annihilation,https://www.imdb.com/title/tt0119707/,This is probably the worst sequel ever,"I have been a huge fan of the MK videogames practically since the beginning, and I really enjoyed the first Mortal Kombat movie. It wasn't a work of art, but it was fun, funny, colorful and had some great fight scenes. Anihilation, though, suffers from an extreme case of sequelitis, with about half of the characters re-cast, all of which were a step down, a dumb story line, wooden acting, effects that were less advanced than the ones in the first movie, and a feeling of blah pervading the whole thing. Perhaps the worst thing is the fight at the end with the two really bad CG ""animalities"", a cheesy idea from the game that should have stayed in the game. Liu Kang's dragon looked like a pear with wings and a tail. Definitely avoid this one if you wish to keep your glowing memories of the arcade game intact.",positive
38,19-tt0307109,The Lost Skeleton of Cadavra,https://www.imdb.com/title/tt0307109/,A hilarious genre spoof!,"You don't have to be brilliant to know that it's much easier to make a bad movie than a good one, you also don't have to be a genius to see that sometimes bad movies are just more entertaining.  Scientist and his wife are having a strange weekend, what with aliens dropping in for dinner along with a half-animal woman, an evil scientist, a rubber mutant from space, and a very crabby skeleton.  The Lost Skeleton of Cadavra is a sharp-witted send up of all those wonderfully cheesy horror/sci-fi flicks of the '50's. This spoof has all the elements - lame FX, a silly plot, corny dialog, wooden acting, heck it's even shot in black and white. What really makes this movie great though is just how much unexpected humor erupts from all of this. The actions of the 'aliens' attempting to act human, the laughably awful voice-over for the 'lost' skeleton, and of course Animala's antics. Yet at the same time the movie never goes over board with its jokes.  A great spoof all the way, with plenty of finely tuned comedy (and more catch phrases than you can imagine) The Lost Skeleton of Cadavra is a heart-felt tribute to the films that are so bad...they're good.  *** 1/2 out of ****",positive
39,21-tt0307109,The Lost Skeleton of Cadavra,https://www.imdb.com/title/tt0307109/,It Wasn't Even Good Schlock,"I often get kidded for my choice of Monster Movies - Zombies of Mora Tora, Terrors of Spider Island, Queen of the Zombies, etc, so I like Schlock. There is the nostalgia I feel when I see the movies I used to take seriously as an adolescent. I used to think Batman was a drama too! I enjoy watching them today with like-minded people. We make fun of them and have a great time doing it.  But this movie contained none of the nostalgia that I was accustomed to. Mostly because it was made in 2001, not 1961.  It also just plain didn't work. Its like they TRIED to make a stupid movie. They succeeded. It was so stupid I couldn't watch it.  The other types of movies I mentioned worked because they were made as serious movies, at least for kids, and adults get a kick out of watching because of all the mistakes in them. This piece of schlock is one scene of DELIBERATE moronic humor after another.  For example, the constant references to science and scientists are a way to get us to laugh at an intentional mistake. Sorry, the repetition is exhausting after awhile.  Anyway, Lost Skeletons of Cadavra could have been a good spoof on 1950's monster movies. But it was a huge disappointment.",negative
40,11-tt0054038,The Lost World,https://www.imdb.com/title/tt0054038/,A popcorn  movie if ever there was one!,"A daring expedition constituted by Professor Challenger(Claude Rains),a scientific(Richard Haydn),an adventurer named Rolston(Michael Wilding),a journalist(David Hedison),an explorer(Fernando Lamas),the magnate's daughter(Jill St John)among others journey to remote location where are roaming prehistoric dinosaurs and savage cannibal tribes still alive.They confront against the nature's most fearsome predators that savagely stalking its prey.  It's an amusing old-fashioned and dated adventure from Arthur Conan Doyle(Sherlock Holmes's author)novel that follows the wake of ¨Journey of the center of the earth¨ by Henry Levin previously filmed,in fact the finale part into the cave is similarly realized ,including a cliff-hungers scenes where the protagonists are dangling over a dangerous cliffs pursued by a cruel natives .An ambitious production values and quite entertaining considering its age.The Jurassik creatures are made by transparency as a giant spider and a lizards increased by optics effects. The story was impressive when first released but it looks pretty silly for standards nowadays. Dinosaurs delivers the goods with chills,grisly screams when the beasts appear,thus the climax film happens when the giant lizards running amok and are fighting among them.The motion picture is regularly directed by Irwin Allen, the catastrophe cinema's creator(Adventure Poseidon,Towering inferno,Swarm).This story was formerly adapted in a silent movie(1925)and with dinosaurs made by the great Willis O'Brien(King Kong).Anothers remakes are filmed in 1993 by Timothy Bond with John Rhys Davies and of course the especial adaptation by Steven Spielberg :The lost world, Jurassik Park. The flick will like to the juvenile public and and adventures movie fans but best enjoyed in big screen",positive
41,10-tt0054038,The Lost World,https://www.imdb.com/title/tt0054038/,Irwin Allen's Lost Word,"You would expect much more from an Irwin Allen film than 1960's The Lost World delivers. This film is high on silly-to-obnoxious characters, and corniness. The first few scenes in the film are particularly loaded down by corniness as we are introduced to the characters. There's eccentric Professor Challenger (Claude Rains) with his silly facial expressions, and boisterous but stuffy personality. There's Lord John Roxton (Michael Rennie) with his selfish and uncharming personality. There's Jennifer Holmes (Jill St. John) who starts out by trying to show the men a woman can also be worthy to take along on an expedition, but then becomes a useless, timid character who shows no strengths at all. The sexist remarks made by some male characters in the beginning become even more obnoxious, because Jennifer never comes through on showing strength, courage or ideas to help her crew members. The only strength she really proves is that she can pick out some elegant but inappropriate clothing to wear during the dangerous expedition. Jennifer has also brought along her silly, little poodle named Frosty. And then there's Costa (Jay Novello), a wimpy, greedy, seedy, little man. Throw in Fernando Lamas as Manual Gomez, the hired helicopter pilot who is also along for a side plot of personal revenge. He plots his murder-revenge and strums his guitar along the way (the natives even let him keep his guitar when the group is captured!) Not too many characters to really care for, but there are a few to possibly like such as Jennifer's brother, David (Ray Stricklyn.) David actually turns out to be more of a help then originally believed. A captured native girl (Vitina Marcus) turns out to be one of the better characters in the picture, but that is most likely because she has none of the corny lines and characteristics the expedition party's characters have. There's also corny drama from a love triangle that forms along the way. We all know Claude Rains (Phantom Of The Opera), Michael Rennie (The Day The Earth Stood Still) and others can do fine acting jobs, and the acting in this movie is fine--It's just most of the characters are so corny at times it should be embarrassing to the stars of the picture. The action in the film does not really build to any exciting levels as the crew is menaced by various creatures. The dinosaurs are lizards and reptiles with fins and horns applied to their bodies, and the giant spider is a rather lame effect (especially since it just hangs there, and only moves its legs a bit.) There is an unpleasant scene in which a real lizard fights a real reptile (portraying dinosaurs) that seems very politically incorrect by today's standards (and should have been a no-no even back in 1960.) Irwin Allen and 20th Century Fox could've done much better than this, and it is not nearly as good of a film as Journey To The Center Of The Earth (also from 20th Century Fox.) Still, The Lost World may entertain on a Saturday afternoon matinee level, and it is one of those movies collectors of horror and science fiction films will probably want to add to their 1950's and 1960's collections.",positive
42,3-tt1522835,Sherlock Holmes,https://www.imdb.com/title/tt1522835/,What did I just watch,"Sherlock Holmes is not a good movie by a long shot, but in comparison to some of the other movies Asylum has churned out it is not that bad either.  I do agree it does have its problems. The film is low budget, and some of it does show, as some of the production values while not terrible are not great. Some of the editing could have been better, while the film is dully lit and some of the sets, locations and costumes are just okay if somewhat uninteresting. The dinosaur and dragon are quite good though. The film is too short, and I think too rushed as well, and while it was nice to listen to the soundtrack was forgettable soon after. Ben Syder does do what he can with the iconic detective known as Sherlock Holmes but I couldn't help thinking in terms of mannerisms and appearance he was miscast.  However, the direction was decent, as was the script which had some nice touches without being entirely exceptional. While it does have its holes and quite strange in its feel, the story is an interesting one and entertaining enough if you don't think about it too much, the villain is enjoyable and there are some good performances from Gareth David as a more quiet and composed Watson and Dominic Keating. Elizabeth Arends is lovely, and the climax was diverting and much better than I expected.  Overall, there is nothing outstanding on display, and those who are looking for a faithful adaptation will be disappointed. But it is mildly entertaining with some good things if you don't take it too seriously. 5/10 Bethany Cox",positive
43,2-tt1522835,Sherlock Holmes,https://www.imdb.com/title/tt1522835/,"Strange film, not very good but sort of entertaining.","This is an astounding terrible movie which obviously had a pretty significant budget  To be fair here are some good points, effects, filming and sets.   Everything else was painful to watch without fast forwarding Pointless dialog Completely wrong casting for Sherlock Holmes Plot with so many holes discontinuities and absurdities Editing. If this film was edited at all it would be about 30 min long. It has many pointless scenes which add nothing to the story Bizarre non-Sherlock Holmes characters... like a brother named Thorpe who worked with Lestrade???  Definitely one of the worse movies I have ever seen and it isn't even bad in a good way, just tedious and dumb.",negative
44,15-tt0089185,The Galaxy Invader,https://www.imdb.com/title/tt0089185/,I would Rather Eat Other People's Earwax Than Watch This Piece of Drek Again,"It is so bad it is almost funny... but it's not. The sad thing is that I really wanted to see a bad cheesy sci fi movie, but it was too horrible to watch. The loud ""eerie"" sound effects, the ridiculous music, the bad camera angles, the incredible bad acting, the green rubber alien who breaths like Vader, the horrendous dialogue, the redneck father that wants to shoot his daughter because she threw a glass of water in his face...   Just stay away from it. I made the effort of writing enough of a comment so that it gets saved and protect potential viewers from this crap.",negative
45,17-tt0089185,The Galaxy Invader,https://www.imdb.com/title/tt0089185/,The title is misleading,"Appearing like a stranger from a strange land, The Galaxy Invader must have thrown people for a loop back in '85. At a time when slashers were all the rage, the PG level thrills and cracked sci-fi spills are about the last thing you could expect, but lowbrow legend Don Dohler pulls it off and then some. The key to it all is commitment, there's a fair amount of overlap between cast and crew and many of both cast and crew cut their teeth on previous Dohler pictures, which he had been making for a while. It all adds up to confidence, to actors pinging off each other with dramatic result, bold use of shaky effects, competent framing, poignant message, this is a film where all the lunacy can't overpower the fact that these people weren't screwing around. There's effort here and it shines. The plot wraps around an alien crash-landing in redneck backwoods territory espied by a couple of mean spirited idiots, Joe Montague and Frank Custor (can you smell the sweat?) who elect to catch and sell it. Meanwhile, a sky watching professor and his student are on the hunt for the being, and Joe's wife and daughter are just trying to get away safe from him. The film wrong-foots the viewer pretty early on, man is the aggressor here, man the wild beast. The title is a misnomer, the alien isn't any kind of an invader and is actually kinda sympathetic, also it has the look of a novelty store riff on the Creature from the Black Lagoon. At times it almost feels like a red herring in its own film, such is the focus on the nefarious Joe. With a lesser actor this wouldn't have worked at all, but Richard Ruxton brings a tour de force to the table, with a perpetual scowl plastered on his face and twitchy, violently irate demeanour he blows gusts of derangement through his every moment of screen time, a remarkable gonzoid villain. Don Leifert is slightly lower key but nonetheless palpably loathsome as Frank, while various Dohler relatives and local types bulk out the cast. There are a few shootings, cool shonky mini explosion effects and powerful spurts of tension, this undoubtedly aided by driving synths from Norman Noplock (sadly this is his only credit), like I said up top this one is committed and so when it strikes, it strikes hard. Things move at a smart clip and the short runtime feels like a breeze, by the time the ending locks in it's a breathless ride and the ending itself is a terrific capper. Now I wouldn't possibly recommend this to ""regular"" cinema fans, but as a devotee of low budget science fiction lunacy I thought this a really great time. If you're still reading this, you might to. Check it out say I, 7/10.",positive
46,14-tt0099978,Laser Mission,https://www.imdb.com/title/tt0099978/,Best of the Worst,"Brandon Lee stars as 007 styled spy (Or he's a mercenary because the damn song that kept playing called him a mercenary, go figure) who travels to South Africa to rescue a scientist (Borgnine, in an accent that must be heard to be believed) from a bunch of goons who want Borgnine to turn a diamond into a laser weapon. (This plot angle certifies the level of credibility we are dealing with) Brandon Lee sure made a lot of bad movies in his day. With the overrated Rapid Fire, the mediocre (though watchable)Showdown In Little Tokyo and of course this movie, one can only conclude that The Crow really was his best effort. (Actually his Hong Kong produced movie Legacy Of Rage is supposed to be pretty good. I ordered it, to review it) Anyway Laser Mission is easily the worst from Brandon Lee but that's not to say it isn't entertaining. It is in fact ultimately hilarious. When Laser Mission starts we witness men put gas-masks on while the credits role and the Laser Mission theme plays and we meet people at a party, when the guy explains the caliber of quality of the diamond, the crowd breaks out in hilarious whistling. The directing apparently implies that this was filmed with a hand-held camera (the cheapest type) and people are gassed all for a diamond which looks really fake. Brandon Lee then arrives talks to Ernest Borgnine, gets shot with a dart and then wakes up in prison. He fights his way out and these action sequences are truly stilted. Worst of all is the acting from Debi Monahan (The Seinfeld chick who got killed, right?) Her high pitched squealing along with Lee's overly smug presence (Seriously Brandon Lee was an appealing actor, but not here) make for the funniest moments. Brandon Lee also dresses up as a Cuban, we see two Cuban soldiers who are movie's would be comic relief make the same jokes over and over again. The funniest part of the movie is the climax where we see Brandon Lee get shot at by the main bad guy but then run him over with the car. However when he gets shot at, he's standing outside the car, the next shot is edited of the car charging towards him. Hilarious. More unintentional hilarity ensues but hey this movie was only 2.99 and if you're a big time Brandon Lee fan, or a fan of camp this is perfect cheese.  * out of 4-(Bad)",negative
47,0-tt0099978,Laser Mission,https://www.imdb.com/title/tt0099978/,Where is this happening ???,"Michael Gold (Brandon Lee) is a mercenary hired by the CIA to find a German scientist (Ernest Borgnine). The scientist has developed a laser technology that everyone wants. After their rendezvous on the beach, both Brandon and Borgnine are captured. This sets up the daring escape by Brandon, after which he volunteers to go back and find the professor.  This movie is classically bad. It seems to take place in Africa, with Soviet, Cuban and German soldiers involved. Debi Monahan rounds up the cast as the professor's daughter. She is thoroughly annoying in this role, as her voice seems to increase in pitch as she gets louder and is also very whiny. The only redeeming qualities of her character is her push up blue dress, which seems to be the only thing she wears during the movie (she does wear a white jump suit at the beginning and a bed sheet after the ""sex"" scene).  Brandon Lee is suppose to be the star of this movie, however, he comes off quite flat. Its not just the acting thats bad but also the action. I haven't seen so many drop-kicks since Star Trek : The Original Series. He also tries to emulate his father by doing ""characterizations"" (see Chinese Connection). The slapping Manuel sketch is a good indicator how bad his acting is. It is funny though. He also seems to pull off an Arab beggar.  To complement Brandon (other than Debi Monahan), we get Mr. Borgnine (whom we see actually sleeping during a scene), a crazy Soviet Colonel (who refuses to die), a white big game hunter and a pair of bungling Cuban soldiers (a female Sergeant and the beloved Manuel).  Nothing sums up this movie more completely than the ""theme song"" of the movie (Mercenary Man), which seems to be playing in either muzak form or the 80's bad rock form and the dialog.  Dialog such as :   (Brandon) I did my job. Pay me and let me get the hell outta here.  (CIA suit) Kiss ... my ... ass !!!   (Brandon) NO !  This movie was definitely worth the $4 I spent on it. RIP Brandon.  -Celluloid Rehab",positive
48,16-tt0052077,Plan 9 from Outer Space,https://www.imdb.com/title/tt0052077/,The Worst Film of All TIme - Plan 9 From Outer Space,"This film is so bad, that it is good. My son Joe and I have seldom laughed so often during a film; even the best comedies from Hollywood. There are so many unintentionally hilarious scenes, that one hardly knows where to begin. Let's start with Lugosi. Somehow, he does not look like your typical Long Island houseowner; his European cape is strangely not in sync with the rest of the community. The gravedigger scene is very funny as well. How cheap are the people in this community with their loved one's graves? A cheap wooden cross instead of a headstone? That is pretty cheap; but not as cheap as the sets in this film. Ed Wood, bless his soul, does a masterful job of ruining every scene with horrendous props. I love the curtains separating the pilots of an airliner from the passengers that we never see. Great security. Remind me not to travel on that airline. But this is not the only place with curtains. The pilot's home (even though he lives outside with his wife) has curtains outside the home. I have never seen this decor before. Even the spaceship has curtains. The people who made curtains as props for this film made a fortune.  I think that The Price is Right must have the director's favorite TV show. (What's behind curtain number two?). The cast had two major problems; very few of them knew how to drive a car. Two of them put the cars in reverse before driving. Two others leave the lights after leaving the car. Another problem area for both the police and the aliens are their weapons. They don't seem to work. The aliens are forced to flee when their microwave oven catches fire. This is perfectly understandable. There is also a very fat man who wanders around looking for food and a scantily-dressed woman who doesnt change her clothes for four days and can be smelled from over 100 yards away. This film is not half-baked; it not even in the oven. But it very funny to watch.",positive
49,20-tt0052077,Plan 9 from Outer Space,https://www.imdb.com/title/tt0052077/,Bad movie?? You're soaking in it!!,"I'm giving this rating to this mess because over time it has found the hearts of so many people. How can one really hate the absolute diligence and undying spirit of Ed Wood. This movie has everything. Silly aliens. People rising from the grave. Vampires. Ridiculous flying saucers. And, without a doubt, some of the worst acting that has ever been committed to celluloid. And, still, we laugh and look forward to each scene because we know what's next. We know that Bela passed away and a guy who has no physical resemblance to him had to take over. There is no real plot. I believe that the worst list is for movies that have no heart--something like ""Godzilla vs. Freddy Mercury."" I believe that there are and were directors who simply wrote for the third feature at drive-in movies where the kids didn't even watch. If you've not seen this film. Have the fun of viewing it for the first time.",positive
50,3-tt0108255,Super Mario Bros.,https://www.imdb.com/title/tt0108255/,Not as bad as some say!,"I actually enjoyed this movie, despite the terrible reviews and the terrible user ratings. Its plot is fair, it's effects are great, even for now, and the acting, although certainly not brilliant, is fair enough to work with the plot. I'd give it a 7/10.",positive
51,7-tt0108255,Super Mario Bros.,https://www.imdb.com/title/tt0108255/,It's a Mario Movie. Where's the Mario?,"This is one of those movies I loved as a thirteen year old, I remember seeing it a few times. It was a film naturally aimed at my age group in 1993, I wish people would remember that when writing up such serious reviews. It's quite a fun story, the special effects are probably a little naff thirty years later, but what do you expect? Bob Hoskins is good fun.  I'm surprised by just how dark the story is, funny how you have a different look on things when you're young.  What I found interesting, was the theme music, Almost Unreal by Roxette, what an awesome track, arguably the best aspect of the film.  Fun, 7/10.",positive
